{
  "schema_version": 1,
  "catalog_id": "smells-core",
  "catalog_version": "1.0.0",
  "source_manifest": "smells-sources@1.0.0",
  "item_count": 36,
  "concepts": [
    {
      "id": "long-method",
      "catalog_state": "accepted",
      "summary": "A callable concentrates enough behavior or control flow that its responsibilities become difficult to understand and change independently.",
      "aliases": [
        {
          "name": "Long Function",
          "source_ids": [
            "fowler-refactoring-2e"
          ]
        }
      ],
      "references": [
        {
          "source_id": "fowler-beck-refactoring-1e",
          "source_term": "Long Method",
          "relationship": "defines",
          "reference_url": "https://ptgmedia.pearsoncmg.com/images/9780201485677/samplepages/0201485672.pdf#page=9",
          "source_locator": "Chapter 3 table of contents on PDF p. 9 — Long Method (definition begins on printed page 76)",
          "ordinal": 2,
          "access_scope": "table_of_contents",
          "reference_role": "catalog_inventory"
        },
        {
          "source_id": "fowler-refactoring-2e",
          "source_term": "Long Function",
          "relationship": "refines",
          "reference_url": "https://www.informit.com/articles/article.aspx?p=2952392&seqNum=3",
          "source_locator": "Chapter 3 — Long Function; printed p. 73; PDF p. 95; InformIT page 3 of 24",
          "ordinal": 3,
          "access_scope": "full_text",
          "reference_role": "concept_guidance"
        },
        {
          "source_id": "refactoring-guru-smells-web",
          "source_term": "Long Method",
          "relationship": "names",
          "reference_url": "https://refactoring.guru/smells/long-method",
          "source_locator": "Bloaters — Long Method",
          "source_category": "Bloaters",
          "ordinal": 1,
          "access_scope": "full_text",
          "reference_role": "concept_guidance"
        },
        {
          "source_id": "mantyla-vanhanen-lassenius-2003",
          "source_term": "Long Method",
          "relationship": "classifies",
          "reference_url": "https://aaltodoc.aalto.fi/server/api/core/bitstreams/b5830068-b3bd-4866-866a-4de82355f9b0/content",
          "source_locator": "Section 3 taxonomy — Bloaters — Long Method",
          "source_category": "Bloaters",
          "ordinal": 1,
          "access_scope": "full_text",
          "reference_role": "taxonomy"
        }
      ],
      "language_support": {
        "rust": {
          "applicability": "applicable",
          "detector_support": "stable"
        },
        "python": {
          "applicability": "applicable",
          "detector_support": "stable"
        },
        "typescript": {
          "applicability": "applicable",
          "detector_support": "stable"
        }
      }
    },
    {
      "id": "large-class",
      "catalog_state": "accepted",
      "summary": "A class or type accumulates an unusually broad state or behavior surface that may contain several responsibilities.",
      "aliases": [],
      "references": [
        {
          "source_id": "fowler-beck-refactoring-1e",
          "source_term": "Large Class",
          "relationship": "defines",
          "reference_url": "https://ptgmedia.pearsoncmg.com/images/9780201485677/samplepages/0201485672.pdf#page=9",
          "source_locator": "Chapter 3 table of contents on PDF p. 9 — Large Class (definition begins on printed page 78)",
          "ordinal": 3,
          "access_scope": "table_of_contents",
          "reference_role": "catalog_inventory"
        },
        {
          "source_id": "fowler-refactoring-2e",
          "source_term": "Large Class",
          "relationship": "defines",
          "reference_url": "https://www.informit.com/articles/article.aspx?p=2952392&seqNum=20",
          "source_locator": "Chapter 3 — Large Class; printed p. 82; PDF p. 104; InformIT page 20 of 24",
          "ordinal": 20,
          "access_scope": "full_text",
          "reference_role": "concept_guidance"
        },
        {
          "source_id": "refactoring-guru-smells-web",
          "source_term": "Large Class",
          "relationship": "names",
          "reference_url": "https://refactoring.guru/smells/large-class",
          "source_locator": "Bloaters — Large Class",
          "source_category": "Bloaters",
          "ordinal": 2,
          "access_scope": "full_text",
          "reference_role": "concept_guidance"
        },
        {
          "source_id": "mantyla-vanhanen-lassenius-2003",
          "source_term": "Large Class",
          "relationship": "classifies",
          "reference_url": "https://aaltodoc.aalto.fi/server/api/core/bitstreams/b5830068-b3bd-4866-866a-4de82355f9b0/content",
          "source_locator": "Section 3 taxonomy — Bloaters — Large Class",
          "source_category": "Bloaters",
          "ordinal": 2,
          "access_scope": "full_text",
          "reference_role": "taxonomy"
        }
      ],
      "language_support": {
        "rust": {
          "applicability": "applicable",
          "detector_support": "stable"
        },
        "python": {
          "applicability": "applicable",
          "detector_support": "stable"
        },
        "typescript": {
          "applicability": "applicable",
          "detector_support": "stable"
        }
      }
    },
    {
      "id": "primitive-obsession",
      "catalog_state": "accepted",
      "summary": "Raw primitive values are used where domain-specific values or types could preserve meaning, validation, or invariants.",
      "aliases": [],
      "references": [
        {
          "source_id": "fowler-beck-refactoring-1e",
          "source_term": "Primitive Obsession",
          "relationship": "defines",
          "reference_url": "https://ptgmedia.pearsoncmg.com/images/9780201485677/samplepages/0201485672.pdf#page=9",
          "source_locator": "Chapter 3 table of contents on PDF p. 9 — Primitive Obsession (definition begins on printed page 81)",
          "ordinal": 9,
          "access_scope": "table_of_contents",
          "reference_role": "catalog_inventory"
        },
        {
          "source_id": "fowler-refactoring-2e",
          "source_term": "Primitive Obsession",
          "relationship": "defines",
          "reference_url": "https://www.informit.com/articles/article.aspx?p=2952392&seqNum=11",
          "source_locator": "Chapter 3 — Primitive Obsession; printed p. 78; PDF p. 100; InformIT page 11 of 24",
          "ordinal": 11,
          "access_scope": "full_text",
          "reference_role": "concept_guidance"
        },
        {
          "source_id": "refactoring-guru-smells-web",
          "source_term": "Primitive Obsession",
          "relationship": "names",
          "reference_url": "https://refactoring.guru/smells/primitive-obsession",
          "source_locator": "Bloaters — Primitive Obsession",
          "source_category": "Bloaters",
          "ordinal": 3,
          "access_scope": "full_text",
          "reference_role": "concept_guidance"
        },
        {
          "source_id": "mantyla-vanhanen-lassenius-2003",
          "source_term": "Primitive Obsession",
          "relationship": "classifies",
          "reference_url": "https://aaltodoc.aalto.fi/server/api/core/bitstreams/b5830068-b3bd-4866-866a-4de82355f9b0/content",
          "source_locator": "Section 3 taxonomy — Bloaters — Primitive Obsession",
          "source_category": "Bloaters",
          "ordinal": 3,
          "access_scope": "full_text",
          "reference_role": "taxonomy"
        }
      ],
      "language_support": {
        "rust": {
          "applicability": "applicable",
          "detector_support": "stable"
        },
        "python": {
          "applicability": "applicable",
          "detector_support": "stable"
        },
        "typescript": {
          "applicability": "applicable",
          "detector_support": "stable"
        }
      }
    },
    {
      "id": "long-parameter-list",
      "catalog_state": "accepted",
      "summary": "A callable requires many independent inputs, making call sites harder to understand and suggesting missing cohesive values or mixed responsibilities.",
      "aliases": [],
      "references": [
        {
          "source_id": "fowler-beck-refactoring-1e",
          "source_term": "Long Parameter List",
          "relationship": "defines",
          "reference_url": "https://ptgmedia.pearsoncmg.com/images/9780201485677/samplepages/0201485672.pdf#page=9",
          "source_locator": "Chapter 3 table of contents on PDF p. 9 — Long Parameter List (definition begins on printed page 78)",
          "ordinal": 4,
          "access_scope": "table_of_contents",
          "reference_role": "catalog_inventory"
        },
        {
          "source_id": "fowler-refactoring-2e",
          "source_term": "Long Parameter List",
          "relationship": "defines",
          "reference_url": "https://www.informit.com/articles/article.aspx?p=2952392&seqNum=4",
          "source_locator": "Chapter 3 — Long Parameter List; printed p. 74; PDF p. 96; InformIT page 4 of 24",
          "ordinal": 4,
          "access_scope": "full_text",
          "reference_role": "concept_guidance"
        },
        {
          "source_id": "refactoring-guru-smells-web",
          "source_term": "Long Parameter List",
          "relationship": "names",
          "reference_url": "https://refactoring.guru/smells/long-parameter-list",
          "source_locator": "Bloaters — Long Parameter List",
          "source_category": "Bloaters",
          "ordinal": 4,
          "access_scope": "full_text",
          "reference_role": "concept_guidance"
        },
        {
          "source_id": "mantyla-vanhanen-lassenius-2003",
          "source_term": "Long Parameter List",
          "relationship": "classifies",